,index,Unnamed: 0,brand,id,created_at,text,likes,in reply to,retweeted,nb_words,text_len,subjectivity,polarity,negative,neutral,positive,compound,similarity
549,550,550,LOCCITANE_UK,1278720574500397056,2020-07-02 16:01:57,we are proud to announce that we have won the uks best workplaces for women for large organisations awards certifi ,13,,False,20,115,0.5761904761904763,0.6714285714285714,0.0,0.533,0.467,0.9325,0.97749734
550,551,551,LOCCITANE_UK,1277633502851133440,2020-06-29 16:02:19,if you have any questions about our reopening please let us know below find your nearest store here ,2,,False,18,100,0.0,0.0,0.0,0.881,0.119,0.3182,0.85156256
551,552,552,LOCCITANE_UK,1277599923307937793,2020-06-29 13:48:53, we are sorry to let you know this fragrance has been discontinued and is sold out now,0,alsaleh1234567,False,17,86,1.0,-0.5,0.075,0.925,0.0,-0.0772,0.97829235
552,553,553,LOCCITANE_UK,1277591464151834625,2020-06-29 13:15:16, thanks for the message if you could dm us the batch number on the product we can let you know ,0,Slt143Teale,False,20,95,0.2,0.2,0.0,0.811,0.189,0.4939,0.88124335
553,554,554,LOCCITANE_UK,1277270638365822977,2020-06-28 16:00:25,the best baths are those with lots of foam and bubbles dont you agree use our lavender foaming bath to turn ,6,,False,21,108,0.3,1.0,0.083,0.751,0.166,0.4749,0.9738555
554,555,555,LOCCITANE_UK,1276878979732066304,2020-06-27 14:04:06, thanks for your interest in our products the only product we recommend for pregnancy is our shea butter organic certified ,0,ptrangjenny,False,20,123,0.6,0.1,0.0,0.669,0.331,0.8126,0.9760181
555,556,556,LOCCITANE_UK,1276546274599170048,2020-06-26 16:02:03,have you visited us since the reopening share with us your experience in the comment below find your nearest st ,3,,False,20,112,0.0,0.0,0.0,0.896,0.104,0.296,0.78127533
556,557,557,LOCCITANE_UK,1275742339189952512,2020-06-24 10:47:30, thanks for the shout out ,1,StPancrasInt,False,5,26,0.2,0.2,0.0,0.58,0.42,0.4404,0.7696793
557,558,558,LOCCITANE_UK,1275459281748234241,2020-06-23 16:02:44,share some tips and tricks with us on how you have been taking care of your hair during this time ,3,,False,20,98,0.0,0.0,0.063,0.711,0.226,0.5994,0.9795699
558,559,559,LOCCITANE_UK,1275096311423893507,2020-06-22 16:00:25,looking for a fun activity to do with your kids heres a diy idea transform an empty bottle of shower gel into ,5,,False,22,110,0.35,0.0999999999999999,0.078,0.779,0.143,0.3612,0.94706774
559,560,560,LOCCITANE_UK,1275084723367403521,2020-06-22 15:14:22, this is our almond delicious hands you can buy this on our website currently enjoy ,1,kevbev321,False,15,84,0.75,0.7,0.0,0.653,0.347,0.7845,0.9168754
560,561,561,LOCCITANE_UK,1275074039954853889,2020-06-22 14:31:55, we are sorry to hear this please dm us with your details so we can assist you with this,0,_emmam_,False,19,88,1.0,-0.5,0.062,0.812,0.125,0.3237,0.86816174
561,562,562,LOCCITANE_UK,1275068347210534912,2020-06-22 14:09:18, our terracycle service is currently on hold for now as a health and safety precaution we plan to continu ,0,nadicllx,False,19,106,0.4,0.0,0.0,0.859,0.141,0.4215,0.9648031
562,563,563,LOCCITANE_UK,1274734338886660097,2020-06-21 16:02:04,happy fathers day today we celebrate all the dads and father figures in our life let us know what you have plan ,5,,False,22,112,1.0,0.8,0.0,0.73,0.27,0.8126,0.9844089
563,564,564,LOCCITANE_UK,1274371564671098881,2020-06-20 16:00:32,sometimes you just want to close your eyes and breathe in the scents of provence our lavender liquid soap is enr ,11,,False,21,113,0.0,0.0,0.0,0.939,0.061,0.0772,0.95695186
564,565,565,LOCCITANE_UK,1274009600279236608,2020-06-19 16:02:13,happy national refill day join the refill revolution and do your bit in the fight against plastic pollution ,10,,False,18,108,1.0,0.8,0.111,0.638,0.251,0.5106,0.9802424
565,566,566,LOCCITANE_UK,1273571411773161472,2020-06-18 11:01:01,in these times we have adapted our ways of shopping here are the ways to buy your favourite loccitane products ,4,,False,20,111,0.0,0.0,0.0,1.0,0.0,0.0,0.9859458
566,567,567,LOCCITANE_UK,1273249502305058816,2020-06-17 13:41:51, thanks for the shout out we will forward your feedback on to our production team ,0,dvcclawler,False,15,82,0.2,0.2,0.0,0.828,0.172,0.4404,0.8127426
567,568,568,LOCCITANE_UK,1273233947300786176,2020-06-17 12:40:03,we are priotitising employee and customer health and safety thus protecting society at large dont hesitate to ,12,,False,17,110,0.4285714285714285,0.2142857142857142,0.0,0.765,0.235,0.5594,0.94852084
568,569,569,LOCCITANE_UK,1272893556424880128,2020-06-16 14:07:27, yes we still have our terracycle bins you can take your empties to your local store when it reopens,0,SuperstarE3,False,19,100,0.0,0.0,0.079,0.794,0.126,0.25,0.87841785
569,570,570,LOCCITANE_UK,1272885801198682112,2020-06-16 13:36:38, we are sorry to hear this please contact our customer care team on contactcouk or give them a call on ,0,Rozzi_B,False,20,103,1.0,-0.5,0.056,0.692,0.252,0.6731,0.9028668
570,571,571,LOCCITANE_UK,1272550858534858752,2020-06-15 15:25:42, we have a free cleanser available when you spend on skincare at the moment on our website us ,1,gardeng90552569,False,18,94,0.6000000000000001,0.4,0.0,0.829,0.171,0.5106,0.95888597
571,572,572,LOCCITANE_UK,1272536702779887616,2020-06-15 14:29:27, sorry to hear this please send us a dm so we can look into this for you ,0,cjcjc,False,17,73,1.0,-0.5,0.073,0.781,0.146,0.3237,0.7582655
572,573,573,LOCCITANE_UK,1272528108055334918,2020-06-15 13:55:18, we hope he loves his gift ,1,oh_just_because,False,6,27,0.0,0.0,0.0,0.24,0.76,0.8591,0.8723521
573,574,574,LOCCITANE_UK,1272527819202015232,2020-06-15 13:54:09, thanks for the shout out ,0,LadyOfAManor,False,5,26,0.2,0.2,0.0,0.58,0.42,0.4404,0.7696793
574,575,575,LOCCITANE_UK,1272454033005924352,2020-06-15 09:00:57,we are pleased to let you know that many of our uk stores have started to reopen today on monday june ,16,,False,21,102,0.75,0.5,0.0,0.873,0.127,0.4404,0.9794819
575,576,576,LOCCITANE_UK,1272197350790795264,2020-06-14 16:00:59,still looking for a present for fathers day discover our cedrat range and explore our collection of fragrances an ,4,,False,19,114,0.0,0.0,0.0,1.0,0.0,0.0,0.97673273
576,577,577,LOCCITANE_UK,1271479951724707845,2020-06-12 16:30:18,blacklivesmatter standtogether ,9,,False,2,31,0.0,0.0,0.0,1.0,0.0,0.0,0.55709136
577,578,578,LOCCITANE_UK,1271110144084992001,2020-06-11 16:00:49,discover our new full size verbena hand sanitiser containing alcohol this hand sanitiser with the sweet ,9,,False,16,104,0.5515151515151516,0.2787878787878787,0.0,0.58,0.42,0.8555,0.8883828
578,579,579,LOCCITANE_UK,1270748188522065921,2020-06-10 16:02:32,dont miss the essentialsfordailylifevirtual launch with on june get a behindth ,3,,False,11,79,0.0,0.0,0.0,0.862,0.138,0.1139,0.8934817
579,580,580,LOCCITANE_UK,1270385180839014400,2020-06-09 16:00:04,the key for a perfect makeup application is a smooth and prepped base add our radiance scrub and delicious lip scr ,6,,False,21,115,0.9,0.3199999999999999,0.0,0.62,0.38,0.8689,0.91613156
580,581,581,LOCCITANE_UK,1270381721717018631,2020-06-09 15:46:19, apologies for the delay these hair care products are indeed vegan ,0,Bexlife1,False,11,67,0.0,0.0,0.159,0.621,0.221,0.2263,0.92380786
581,582,582,LOCCITANE_UK,1270381466158063621,2020-06-09 15:45:18, loccitane does not and never has tested its products on animals you can view our full statement here ,0,PixiLouise,False,18,102,0.55,0.35,0.0,1.0,0.0,0.0,0.97656965
582,583,583,LOCCITANE_UK,1270381365213761537,2020-06-09 15:44:54, loccitane does not and never has tested its products on animals you can view our full statement he ,0,deborahbonham,False,18,100,0.55,0.35,0.0,1.0,0.0,0.0,0.96731764
583,584,584,LOCCITANE_UK,1270381020190212101,2020-06-09 15:43:32, we use royal mail we hope this has been helpful ,0,JournoKiwi,False,10,49,0.0,0.0,0.0,0.584,0.416,0.6908,0.83152294
584,585,585,LOCCITANE_UK,1270023017578393600,2020-06-08 16:00:57,when you finally receive your loccitane goodies dont miss out on our summer sale enjoy up to off on sele ,2,,False,20,105,0.75,0.2,0.0,0.795,0.205,0.5638,0.93295074
585,586,586,LOCCITANE_UK,1269298038809350146,2020-06-06 16:00:09,can you guess which product it is tell us below for more quizzes and competition follow us on instagram ,1,,False,19,104,0.5,0.5,0.0,1.0,0.0,0.0,0.971264
586,587,587,LOCCITANE_UK,1268935692605743105,2020-06-05 16:00:19,lets celebrate world environment day the future of our planet depends on our actions today at loccitane wev ,5,,False,18,108,0.125,0.0,0.0,0.821,0.179,0.5719,0.9695008
587,588,588,LOCCITANE_UK,1268573473787400192,2020-06-04 16:00:59,we are delighted to have won the best bath body brand category by beauty awards thank you all ,16,,False,18,94,0.5,0.85,0.0,0.369,0.631,0.9661,0.97781354
588,589,589,LOCCITANE_UK,1268202139437932549,2020-06-03 15:25:26, hi jacqui unfortunately we only have almond shower oil refills available,1,jacquistephens5,False,11,73,0.7,0.2,0.194,0.806,0.0,-0.34,0.9766255
589,590,590,LOCCITANE_UK,1268201390490423297,2020-06-03 15:22:28, hi bex the intensive repair shampoo and conditioner is suitable for vegans ,0,Bexlife1,False,12,76,0.75,0.55,0.0,1.0,0.0,0.0,0.9657978
590,591,591,LOCCITANE_UK,1268132953315512327,2020-06-03 10:50:31, we have asked abhipec to provide an immediate explanation for this publ ,0,tarciziosilva,False,12,73,0.0,0.0,0.0,1.0,0.0,0.0,0.7805403
591,592,592,LOCCITANE_UK,1268132884952514560,2020-06-03 10:50:15, the loccitane group firmly rejects this publication and its content w ,0,tarciziosilva,False,11,71,0.4,-0.2,0.262,0.738,0.0,-0.4939,0.9504592
592,593,593,LOCCITANE_UK,1267747807164686337,2020-06-02 09:20:05,black lives matter blackouttuesday ,19,,False,4,35,0.4333333333333333,-0.1666666666666666,0.0,0.732,0.268,0.0258,0.9492066
593,594,594,LOCCITANE_UK,1267486092619464706,2020-06-01 16:00:07,transport yourself straight to provence the next time you wash your hair enriched with lavender essential oil our ,6,,False,18,114,0.2333333333333333,0.0666666666666666,0.0,0.899,0.101,0.2263,0.8045095
594,595,595,LOCCITANE_UK,1266761371875545088,2020-05-30 16:00:21,whether you want to remove impurities or are simply looking for a product suitable for dry and sensitive skin our ,6,,False,20,114,0.6517857142857143,0.1458333333333333,0.0,0.933,0.067,0.0772,0.97114915
595,596,596,LOCCITANE_UK,1265674816755060736,2020-05-27 16:02:46,bring some memories back with our cherry blossom collection it will transport you to the cherry treedotted hill ,6,,False,18,112,0.0,0.0,0.0,1.0,0.0,0.0,0.9421351
596,597,597,LOCCITANE_UK,1264949364381769728,2020-05-25 16:00:04,discover our new lip oils enriched with vitamin e they will hydrate your lips and leave them looking shiny and pl ,5,,False,21,114,0.4545454545454545,0.1363636363636363,0.056,0.841,0.103,0.25,0.98504156
597,598,598,LOCCITANE_UK,1264164225808650240,2020-05-23 12:00:13,dont forget to treat your feet our shea butter foot cream moisturises and relieves irritated and tired feet to ,5,,False,19,111,0.7,-0.4,0.31,0.532,0.158,-0.6114,0.95484537
598,599,599,LOCCITANE_UK,1263452469931147270,2020-05-21 12:51:57, we are sorry to hear this please contact our customer care team with your email address so they can look ,0,,False,20,106,1.0,-0.5,0.054,0.705,0.241,0.6731,0.86485565
599,600,600,LOCCITANE_UK,1263137594579152896,2020-05-20 16:00:45,get creative and upcycle your empty aqua réotier jars into new herb holders for your kitchen whos going try th ,4,,False,20,111,0.6515151515151515,0.1787878787878788,0.079,0.793,0.128,0.2732,0.970861
600,601,601,LOCCITANE_UK,1260963250394427392,2020-05-14 16:00:41,discover our new almond hair care duo enriched with almond oil from provence this hair care duo helps to softe ,6,,False,20,111,0.4545454545454545,0.1363636363636363,0.0,0.654,0.346,0.8402,0.96080595
601,602,602,LOCCITANE_UK,1260600882472742912,2020-05-13 16:00:45,we are proud to announce that we have won the excellence in wellbeing certificate by this award ,10,,False,17,96,1.0,0.8,0.0,0.464,0.536,0.9435,0.92934656
602,603,603,LOCCITANE_UK,1259901620977950725,2020-05-11 17:42:08,were so excited to have partnered with to create a new product be the first to know and get early ac ,4,,False,21,101,0.459469696969697,0.215340909090909,0.0,0.79,0.21,0.5849,0.96605366
603,604,604,LOCCITANE_UK,1259151173866545154,2020-05-09 16:00:08,our new verbena hydro alcoholic hand gel has of alcohol and a fresh lemony scent thanks to its portable size y ,22,,False,21,111,0.4136363636363636,0.096590909090909,0.0,0.656,0.344,0.8126,0.9536913
604,605,605,LOCCITANE_UK,1257671414217351168,2020-05-05 14:00:06, we are sorry to hear this please send us a dm with your name and order number or email address so we ,1,conejolimon,False,22,102,1.0,-0.5,0.056,0.775,0.169,0.3869,0.9823123
605,606,606,LOCCITANE_UK,1256252072728489984,2020-05-01 16:00:08, meet dee head of property she tries to keep a healthy body and mind with some morning exercises and yoga sessi ,4,,False,21,112,0.45,0.2,0.0,0.876,0.124,0.4019,0.97202027
606,607,607,LOCCITANE_UK,1255890653105360896,2020-04-30 16:03:59,its time to put your mask on specially formulated with natural ingredients our facial masks gently exfoliate yo ,2,,False,18,112,0.4428571428571428,0.1642857142857143,0.0,0.744,0.256,0.6705,0.9502691
607,608,608,LOCCITANE_UK,1255527798770470912,2020-04-29 16:02:08,green tea lovers this one is for you were happy to reintroduce our famous green tea collection opening with s ,10,,False,20,110,0.6499999999999999,0.225,0.0,0.705,0.295,0.7964,0.9578755
608,609,609,LOCCITANE_UK,1254802501867409408,2020-04-27 16:00:04,discover our new invigorating melon face mask enriched with melon from provence and vitamin c whos excited to tr ,11,,False,19,113,0.6022727272727273,0.2556818181818182,0.0,0.661,0.339,0.7717,0.9641398
609,610,610,LOCCITANE_UK,1254077782285418496,2020-04-25 16:00:17, meet ger head of region she is using this time at home to try a new recipe and improve her cooking skills b ,5,,False,23,109,0.4545454545454545,0.1363636363636363,0.0,0.873,0.127,0.4404,0.95374346
610,611,611,LOCCITANE_UK,1253277449002999808,2020-04-23 11:00:03,special announcement for all our almond lovers our almond range is growing were excited to introduce our new ,13,,False,18,109,0.591991341991342,0.2895021645021645,0.0,0.579,0.421,0.8481,0.96596974
611,612,612,LOCCITANE_UK,1252809418560815107,2020-04-22 04:00:16,to do our bit in the fight against plastic we are proud to announce that we have partnered with fo ,5,,False,20,99,1.0,0.8,0.11,0.759,0.131,0.128,0.93407726
612,613,613,LOCCITANE_UK,1252628432724213760,2020-04-21 16:01:05,today our virtual trip in provence takes us to a pretty little village illuminated by the beautiful sun of the sou ,11,,False,21,115,0.8333333333333334,0.3041666666666666,0.0,0.717,0.283,0.7964,0.88173777
613,614,614,LOCCITANE_UK,1252265784560082944,2020-04-20 16:00:03,if you can relate to this leave in a comment below loccitane wfh meme stayhome funnymeme ,7,,False,16,89,0.0,0.0,0.082,0.918,0.0,-0.0644,0.9224055
614,615,615,LOCCITANE_UK,1252185368193048577,2020-04-20 10:40:30, woops thanks for the headsup well refer this to our digital team right away,1,msrachelramsay,False,14,76,0.2452380952380952,0.1619047619047619,0.0,0.706,0.294,0.6124,0.90362793
615,616,616,LOCCITANE_UK,1251541439135117313,2020-04-18 16:01:46, meet vivienne assistant boutique manager being a mother can be intense but vivi is enjoying this precio ,3,,False,17,105,0.8,0.35,0.0,0.709,0.291,0.6956,0.9088477
616,617,617,LOCCITANE_UK,1251178626424455168,2020-04-17 16:00:04,can you guess which product it is tell us below loccitane loccitanebeauty quiz whoami canyouguess ,2,,False,15,98,0.0,0.0,0.0,1.0,0.0,0.0,0.947148
617,618,618,LOCCITANE_UK,1248642300835532800,2020-04-10 16:01:37,our loccitane team sharing their favourite loccitane product to use while working from home tell us below which ,9,,False,18,112,0.0,0.0,0.0,0.859,0.141,0.4215,0.92142665
618,619,619,LOCCITANE_UK,1248241673710206980,2020-04-09 13:29:40, please contact our customer care team at contactcouk regarding your query ,0,Grumbly_Grump,False,11,75,0.0,0.0,0.0,0.621,0.379,0.6705,0.71783286
619,620,620,LOCCITANE_UK,1247917277040619521,2020-04-08 16:00:38,we want to share a second diy activity for you use your empty candle jar into an irresisti ,5,,False,18,91,0.25,-0.05,0.093,0.725,0.181,0.1779,0.6633446
620,621,621,LOCCITANE_UK,1246467604929081345,2020-04-04 16:00:09,give your hands a royal treatment with the rose hand cream enriched with nourishing shea butter this light crea ,5,,False,19,112,0.825,0.5,0.0,0.842,0.158,0.4939,0.92263424
621,622,622,LOCCITANE_UK,1246108475480047616,2020-04-03 16:13:06, hi sarah please contact our customer care team or dm us more details so we can try to find your order thank you,1,weebutterfly87,False,23,112,0.5,0.5,0.0,0.714,0.286,0.7906,0.97664833
622,623,623,LOCCITANE_UK,1245743223277936641,2020-04-02 16:01:43,the best pillow mist to help you relax and fall asleep faster thanks for this nice mention about ,3,,False,18,97,0.5,0.6,0.0,0.456,0.544,0.9382,0.95982623
623,624,624,LOCCITANE_UK,1245380555673202688,2020-04-01 16:00:37,surprise and delight your loved ones this easter with our limited edition easter eggs featuring a selection of irre ,7,,False,19,116,0.4714285714285714,0.3142857142857143,0.074,0.543,0.384,0.8402,0.9458051
624,625,625,LOCCITANE_UK,1245018417213530114,2020-03-31 16:01:36,start the week fresh use our overnight reset eye serum infused with immortelle flower oil known for its antiagei ,3,,False,19,113,0.5,0.3,0.0,0.887,0.113,0.3182,0.89300585
625,626,626,LOCCITANE_UK,1244595300217409537,2020-03-30 12:00:17,looking for an activitie to keep your kids busy this week were here for you use your empty shampoo bottle to ,3,,False,21,109,0.4,0.0,0.083,0.917,0.0,-0.2023,0.92536354
626,627,627,LOCCITANE_UK,1243931002629545986,2020-03-28 16:00:36,tick tock tick tock its nearly time to reset the clock we might lose an hour of sleep tonight but thanks to ,3,,False,22,108,0.3,0.15,0.072,0.778,0.15,0.4588,0.952785
627,628,628,LOCCITANE_UK,1243161037664219136,2020-03-26 13:01:02,thank you so much to all the nhshse workers for all that you are doing at this very difficult time we are so plea ,44,,False,24,114,0.6,-0.225,0.102,0.806,0.092,-0.0754,0.9664845
628,629,629,LOCCITANE_UK,1242496439600599040,2020-03-24 17:00:10, seconds doesnt seem so long when youre singing your favourite song let us know in the comments below your fa ,6,,False,20,110,0.4,-0.05,0.0,1.0,0.0,0.0,0.91884124
629,630,630,LOCCITANE_UK,1242149139728592896,2020-03-23 18:00:07,shut the book close the laptop and reset today introducing our overnight reset eye serum your undereye boost ,4,,False,18,109,0.0,0.0,0.0,0.863,0.137,0.4019,0.9000566
630,631,631,LOCCITANE_UK,1242073664415137793,2020-03-23 13:00:12,during this challenging time we want to be here for you as much as possible thats why we will be sharing some ski ,3,,False,23,114,1.0,0.25,0.0,0.778,0.222,0.5719,0.95678866
631,632,632,LOCCITANE_UK,1241666195209641985,2020-03-22 10:01:04,we know some of you are not able to share some quality time with their loved one on this special day but we want t ,4,,False,25,115,0.6654761904761904,0.269047619047619,0.053,0.73,0.218,0.5451,0.98339474
632,633,633,LOCCITANE_UK,1241348890999132160,2020-03-21 13:00:13,stuck at home take the opportunity to take a relaxing bath we are having one tonight with our almond shower o ,7,,False,21,110,0.0,0.0,0.083,0.667,0.25,0.6124,0.92172974
633,634,634,LOCCITANE_UK,1240699656721461248,2020-03-19 18:00:23,we know you like us may not be able to be with your loved ones this year to celebrate the exceptional women in yo ,7,,False,24,114,0.8083333333333332,0.6222222222222222,0.0,0.675,0.325,0.8779,0.830788
634,635,635,LOCCITANE_UK,1240640444570034177,2020-03-19 14:05:06,love from all at loccitane loccitane staysafe nhs handcream ,681,,False,9,60,0.6,0.5,0.0,0.656,0.344,0.6369,0.9596425
635,636,636,LOCCITANE_UK,1240352283918913537,2020-03-18 19:00:03,we use up to less plastic packaging in our ecorefills and our goal is to offer ecorefill across hair care ,8,,False,20,106,0.0666666666666666,-0.1666666666666666,0.0,0.856,0.144,0.4939,0.98123664
636,637,637,LOCCITANE_UK,1240246866505109504,2020-03-18 12:01:10,still havent found your mothers day present weve got you covered with our selection of gifts mothersday ,3,,False,17,104,0.0,0.0,0.0,1.0,0.0,0.0,0.92468005
637,638,638,LOCCITANE_UK,1239959711677427713,2020-03-17 17:00:07,we wish you a happy st patricks day to celebrate receive this lucky green collection for free when you spen ,0,,False,20,108,0.7333333333333334,0.3333333333333333,0.0,0.464,0.536,0.9451,0.90515375
638,639,639,LOCCITANE_UK,1239597460084756481,2020-03-16 17:00:39,keep your hands soft and smooth with our shea butter hand cream enriched with shea butter and a blend of almond ,8,,False,21,112,0.425,0.25,0.0,0.856,0.144,0.4939,0.9744701
639,640,640,LOCCITANE_UK,1238872634483306496,2020-03-14 17:00:27,refreshing discover our face mask enriched with thyme to purify your skin leaving it feeling soft and hydrated ,4,,False,18,111,0.675,0.3,0.0,0.919,0.081,0.128,0.97381496
640,641,641,LOCCITANE_UK,1238147765827325952,2020-03-12 17:00:05,still looking for the perfect mothers day gift this year treat your mum or motherfigure to the sweetness with ,4,,False,19,110,1.0,1.0,0.0,0.545,0.455,0.91,0.9220518
641,642,642,LOCCITANE_UK,1236623035756474368,2020-03-08 12:01:21,happy internationalwomensday of our solidarity balm proceeds will help finance ngo projects to promote wome ,6,,False,15,108,1.0,0.8,0.0,0.495,0.505,0.8807,0.9429374
642,643,643,LOCCITANE_UK,1236260343988379650,2020-03-07 12:00:09,this internationalwomensday we have spoken to inspiring people at the heart of the loccitane business from head ,3,,False,17,112,1.0,0.5,0.0,0.851,0.149,0.4215,0.93562603
643,644,644,LOCCITANE_UK,1235973479100379136,2020-03-06 17:00:15,mothers day is coming soon go on our website and find the perfect gift choose from our fragrances bodycare and ,5,,False,20,111,1.0,1.0,0.0,0.732,0.268,0.765,0.9827448
644,645,645,LOCCITANE_UK,1235248666572517376,2020-03-04 17:00:06,did you know immortelle essential oil helps your skin cells to mature to allow for faster growth and skin rege ,7,,False,20,111,0.2,0.05,0.0,0.618,0.382,0.836,0.89350176
645,646,646,LOCCITANE_UK,1235174008720691201,2020-03-04 12:03:26, sorry to hear your disappointment we shared your feedback with our production team for their consideration,0,Anniecoops,False,16,107,0.7,-0.55,0.23,0.65,0.12,-0.296,0.70788914
646,647,647,LOCCITANE_UK,1234794297112825856,2020-03-03 10:54:36, hi james how can we help,0,,False,6,25,0.0,0.0,0.0,0.649,0.351,0.4019,0.90996176
647,648,648,LOCCITANE_UK,1234791854463422465,2020-03-03 10:44:54, thank you for the great feedback weve shared this with the store and we know they ,0,Glittermonk3y,False,16,83,0.75,0.8,0.0,0.591,0.409,0.8402,0.9758636
648,649,649,LOCCITANE_UK,1234791298474938368,2020-03-03 10:42:41, hi rebecca were sorry to hear this our answer rate is within hours if you want to email us y ,0,Toffeeseagull,False,20,94,1.0,-0.5,0.066,0.867,0.066,0.0,0.94044054
649,650,650,LOCCITANE_UK,1234523940166369280,2020-03-02 17:00:18,every purchase of solidarity soap one year of vitamin a for three children were working with to tack ,2,,False,18,101,0.0,0.0,0.0,0.773,0.227,0.5267,0.89787614
650,651,651,LOCCITANE_UK,1234161573465247744,2020-03-01 17:00:23, last chance ends today dont miss out on our great offer choose a free gift when you spend use the co ,4,,False,21,102,0.5388888888888889,0.4000000000000001,0.0,0.522,0.478,0.9143,0.9067691
651,652,652,LOCCITANE_UK,1233436869179756544,2020-02-28 17:00:40,take some time for yourself enjoy the extra day and join us instore this weekend for complimentary refreshments a ,3,,False,19,114,0.3666666666666667,0.2333333333333333,0.0,0.644,0.356,0.8074,0.96441585
652,653,653,LOCCITANE_UK,1233074351399813120,2020-02-27 17:00:09,have you ever wanted skin that looks firmer softer with a sweet smell our almond milk concentrate is our bestse ,4,,False,20,112,0.65,0.35,0.0,0.857,0.143,0.4588,0.96260387
653,654,654,LOCCITANE_UK,1232294262538166272,2020-02-25 13:20:21, thank you for the shout out,0,,False,6,28,0.0,0.0,0.0,0.667,0.333,0.3612,0.92166483
654,655,655,LOCCITANE_UK,1232293626547494913,2020-02-25 13:17:50, february see you then ,1,julie17352430,False,4,23,0.0,0.0,0.0,1.0,0.0,0.0,0.73464525
655,656,656,LOCCITANE_UK,1232293121649729537,2020-02-25 13:15:49, we look forward to welcoming you back soon,1,SuperstarE3,False,8,43,0.0,0.0,0.0,0.707,0.293,0.4404,0.9482013
656,657,657,LOCCITANE_UK,1232292997993201665,2020-02-25 13:15:20, hi there were sorry to hear this unless youve instructed our warehouse team how many gift sets are ,0,MrsSardines,False,18,100,0.75,0.0,0.064,0.792,0.144,0.3818,0.95125985
657,658,658,LOCCITANE_UK,1231881608250060800,2020-02-24 10:00:37,as clean your hands and body with our rosemary scented liquid soap which combines effectiveness and ple ,1,,False,17,104,0.7000000000000001,0.3666666666666667,0.0,0.856,0.144,0.4019,0.9726101
658,659,659,LOCCITANE_UK,1231519084715491328,2020-02-23 10:00:04,heres how to get the best of both mix match products to personalise your beauty routine like adding a hydratin ,3,,False,20,111,0.3,1.0,0.0,0.604,0.396,0.8885,0.9113319
659,660,660,LOCCITANE_UK,1231156706240946181,2020-02-22 10:00:07,always onthego pack our new loccitan travel sizes giving you the ultimate scents of provence wherever you g ,1,,False,18,108,0.7272727272727273,0.0681818181818181,0.0,0.87,0.13,0.34,0.9277803
660,661,661,LOCCITANE_UK,1230794396297093120,2020-02-21 10:00:25,dry cracked dehydrated skin this winter treat your body with love with our musthave scrubs discover ,8,,False,16,100,0.6,0.2166666666666666,0.0,0.67,0.33,0.7845,0.9413059
