,index,Unnamed: 0,brand,id,created_at,text,likes,in reply to,retweeted,nb_words,text_len,subjectivity,polarity,negative,neutral,positive,compound,similarity
1484,3989,3989,loccitane_jp,1296004168339972101,2020-08-19 08:40:46, five herbs repair hair milk serum light textured hair milk protects hair from heat and sunshine swells and approaches summer hair troubles ,80,,False,22,140,0.7,0.4,0.109,0.691,0.2,0.3612,0.8590733
1485,3990,3990,loccitane_jp,1295907223659372544,2020-08-19 02:15:33, roxytan immortelle preshoes face mist i use a product that can be used from the top of the old type of package makeup but the grain of mist is larger than others so it is cool to sprinkle on the face when it is hot even when it is in the house h,0,,False,53,246,0.54,0.24,0.0,0.91,0.09,0.5783,0.92415893
1486,3991,3991,loccitane_jp,1295664233561153537,2020-08-18 10:10:00, aqualeotiers eye gel is new refreshing eye gel leads the eyes to a firm clean eyelid care for places that can not be hidden with a mask and fresh crisp eyes ,80,,False,31,158,0.5435064935064935,0.1694805194805194,0.0,0.76,0.24,0.802,0.89797926
1487,3992,3992,loccitane_jp,1295644090227253250,2020-08-18 08:49:57, for you who are concerned about dry stickiness aqualeotier skin care hydration with minerals and hyaluronic acid refreshing feeling and sticky to fresh healthy skin plump gel leads to moisturized and smooth skin ,95,,False,33,213,0.62,0.3266666666666666,0.0,0.749,0.251,0.8271,0.9081117
1488,3993,3993,loccitane_jp,1295545297905389568,2020-08-18 02:17:23, photocon we will hold a photo contest where new products of fragrance verbena that call the new release encounter today please post a scene that you wish to have such an encounter this summer with your favorite photos for details instagr,0,,False,41,238,0.6022727272727273,0.1931818181818181,0.0,0.818,0.182,0.7906,0.8861188
1489,3994,3994,loccitane_jp,1295276428515131393,2020-08-17 08:29:00,it is recommended when i want to get a calm sleep with a refreshing fragrance of mimosa and neroli that can be used for both babys skin and adult skin at such time on hot summer days when the skin tends to stick with sweat on hot summer days details ,74,,False,50,250,0.7083333333333334,0.2333333333333333,0.0,0.891,0.109,0.5267,0.8838494
1490,3995,3995,loccitane_jp,1295187490089795584,2020-08-17 02:35:35, reccitans scalp serum after taking a bath i want to care for it with this and survive summer because it is hot and humid every day and my scalp is uncomfortable ,0,,False,31,162,0.925,-0.125,0.079,0.785,0.136,0.2263,0.91253686
1491,3996,3996,loccitane_jp,1294569116888526858,2020-08-15 09:38:24,introducing how to use the official mail order site while delivering videos of how to use the roxytan official mail order site on igtv i want to buy products at home i want to give gifts to a family far away how to enjoy shopping at a great deals ,59,,False,49,247,0.75,0.4333333333333333,0.0,0.806,0.194,0.836,0.8573742
1492,3997,3997,loccitane_jp,1294509897367707653,2020-08-15 05:43:05, the box of roxytan is so cute that i cut it up and made shiori cute sweets and cosmetic packages are often shiori and i enjoy reading shiori ,0,,False,28,142,0.8333333333333334,0.4666666666666666,0.063,0.56,0.377,0.9147,0.9069278
1493,3998,3998,loccitane_jp,1294192634538278912,2020-08-14 08:42:23,uber eats start roxytan cafe shibuya has started a delivery service at uber eats to commemorate the start of the service we will present a great coupon to those who use it please use it on this occasion ,66,,False,38,203,0.375,0.4,0.0,0.842,0.158,0.7506,0.921335
1494,3999,3999,loccitane_jp,1294095951141847042,2020-08-14 02:18:12, i thought that it was really too hot and the green gradation bottle of the verbena exclusive design of roxytan which opened the perfume for summer is cool and good ,0,,False,30,165,0.52,0.2599999999999999,0.0,0.795,0.205,0.6908,0.9012021
1495,4000,4000,loccitane_jp,1293852678821306368,2020-08-13 10:11:31,you feel either type balancing stress your skin is sensitive you want to relax repair hair is dry and shiny there is no gloss it is easy to get tangle and uncoordinated ,113,,False,32,169,0.7777777777777778,0.1555555555555555,0.128,0.691,0.182,0.2732,0.8800288
1496,4001,4001,loccitane_jp,1293464221418524672,2020-08-12 08:27:56, todays new release verbena clean hand gel hand gel that keeps the hand skin clean is a large capacity and a new appearance keep refreshing hand skin lxcitan news the number is limited ,134,,False,33,185,0.5543599257884971,0.2355596784168212,0.043,0.518,0.439,0.9485,0.8584075
1497,4002,4002,loccitane_jp,1293015522737496064,2020-08-11 02:44:58, summer reward skin kit will be released only on the official mail order site skeleton vanity pouch is also attached to the kit if you review skin care on this occasion htt,0,,False,32,172,1.0,0.0,0.05,0.767,0.183,0.7184,0.86724854
1498,4003,4003,loccitane_jp,1292785345356902402,2020-08-10 11:30:19, photocon information if you post on instagram if you have such an encounter this summer we are holding a campaign to win varvenas new product icy leg mousse body gel massager click here for details,0,,False,35,198,0.3636363636363636,0.2090909090909091,0.0,0.897,0.103,0.5859,0.87086993
1499,4004,4004,loccitane_jp,1292785226402238464,2020-08-10 11:29:51, finding healing goods to work from home loccitane aqua leotier refreshing eye gel cool specifications eye serum i feel that eye strain has accumulated recently because i overuse my eyes i feel that eye strain has accumulated and if i put it in the refrigerator and apply it cold it is an effect of relaxing the muscles of the eyes that are cool and pleasant,0,,False,65,358,0.7527777777777778,0.2222222222222222,0.035,0.803,0.162,0.8658,0.91726476
1500,4005,4005,loccitane_jp,1292396869742518272,2020-08-09 09:46:39, the biggest healing of mask life is the citrus rollon of roxytan so i paint it behind the ear that i want citrus verbena to put out and heal every day ,0,,False,31,152,0.7,-0.4,0.0,0.956,0.044,0.0772,0.90787256
1501,4006,4006,loccitane_jp,1292396760015355904,2020-08-09 09:46:13, locutitans lavender item large set five herbs balancing series provence aroma pillow mist herbal balm lavender flower soap gently loosened with lavender scent,0,,False,23,159,0.6142857142857143,0.2071428571428571,0.0,0.88,0.12,0.4588,0.8951568
1502,4007,4007,loccitane_jp,1291923416950267907,2020-08-08 02:25:20, roxytans citrus verbena eau de toiree cute fragrance is fresh and perfect for summer novelty pouch is also good but i usually do not get a perfume but i want to give a feeling somehow in a nigate summer because of summer ,0,,False,42,222,0.67,0.525,0.0,0.735,0.265,0.7992,0.90228164
1503,4008,4008,loccitane_jp,1291662194296229888,2020-08-07 09:07:19, large set of lavender items of roxytan special collection five herbs balancing series provence aroma pillow mist herbal balm lavender flower soap lavender fragrance ,191,,False,24,166,0.5,0.2857142857142857,0.0,0.895,0.105,0.4019,0.85370255
1504,4009,4009,loccitane_jp,1291542111154667520,2020-08-07 01:10:09, roxytan verbena granite hand cream i like the fine lame and i feel like there is not so much hand cream with lame lol but i can not see in the photo lol i can not see it in the picture lol i glitter when it is cool under the sun with a smooth texture,0,,False,55,251,0.6055555555555556,0.3074074074074074,0.06,0.602,0.338,0.9387,0.90453476
1505,4010,4010,loccitane_jp,1291353300877455361,2020-08-06 12:39:53, you can see the roxytan tv in the archive thank you to everyone who viewed instagram live roxytan tv archive can be viewed from the following url ,70,,False,27,147,0.3,0.0681818181818181,0.0,0.912,0.088,0.3612,0.88883597
1506,4011,4011,loccitane_jp,1291192452443906049,2020-08-06 02:00:44,happy birthday thank you for your patronage of aukide i wish you a wonderful year with the scent of green tea roxytan gift ,44,,False,23,123,0.7666666666666666,0.5333333333333333,0.0,0.508,0.492,0.9382,0.7440845
1507,4012,4012,loccitane_jp,1290981377408741378,2020-08-05 12:02:00,tomorrow we will deliver l tv live we will talk about lavender at harvest time and about the brand please take a look ,76,,False,23,118,0.5,0.1363636363636363,0.0,0.897,0.103,0.3182,0.8726431
1508,4013,4013,loccitane_jp,1290935905398620166,2020-08-05 09:01:18, summer reward skin kit will be released on the official mail order site only the kit also comes with a skeleton vanity pouch why dont you take this opportunity to review your skin care ,109,,False,34,186,1.0,0.0,0.046,0.706,0.247,0.85,0.87807894
1509,4014,4014,loccitane_jp,1290823871164108800,2020-08-05 01:36:07, the smell of melon is the best after the blood color which has gone dull of the lip and it has become a toned up color is the best ,0,,False,29,132,0.3666666666666667,0.5694444444444444,0.075,0.693,0.233,0.7717,0.89210206
1510,4015,4015,loccitane_jp,1290564891498053637,2020-08-04 08:27:02,photocon information if you post on instagram if you have such an encounter this summer we are holding a campaign to win varvenas new product icy leg mousse body gel massager ,90,,False,31,175,0.3636363636363636,0.2090909090909091,0.0,0.884,0.116,0.5859,0.8822948
1511,4016,4016,loccitane_jp,1290457124460519424,2020-08-04 01:18:48, peony shower gel reine blanche trial granité hand cream filled with presents so i love loccitane loccitane loccitane ,0,,False,18,118,0.75,0.45,0.0,0.637,0.363,0.8613,0.8804772
1512,4017,4017,loccitane_jp,1290219384351334401,2020-08-03 09:34:07, lavender harvest season blue gold week starts summer in provence lavender harvest season roxitane celebrates the blessing every year as blue gold week lavender honey i ,124,,False,26,169,0.1,0.0,0.0,0.769,0.231,0.7845,0.9027054
1513,4018,4018,loccitane_jp,1290111196704604161,2020-08-03 02:24:13, there were many polishers and packs that felt the feeling of the skin on the day when i used the sparkling cleanser of roxytan but there was a lot of gloss of the skin that i can feel even if i touch it the next day and there are few powders to use once a week so i did not lose my cospa,0,,False,63,288,0.1999999999999999,0.0999999999999999,0.0,0.898,0.102,0.6289,0.9019078
1514,4019,4019,loccitane_jp,1289858096416698369,2020-08-02 09:38:29, verbena game i tried already puzzle game where the items of verbena series win hapikoi street presents a perfect happi item in summer please play here http,0,,False,27,156,0.55,0.25,0.0,0.633,0.367,0.9042,0.89179444
1515,4020,4020,loccitane_jp,1289512778927976448,2020-08-01 10:46:19, there are many posts to remember roxytans instagram we plan to develop new projects such as instagram live one after another please look forward to special,0,,False,26,156,0.5051948051948052,0.225974025974026,0.0,0.828,0.172,0.6124,0.8834117
1516,4021,4021,loccitane_jp,1289166921183756288,2020-07-31 11:52:00,popularity ranking now hot update the latest popularity ranking of the official online shop verbena granite body gel verbena complete aqua leotier refreshing eye gel items to be worried about ,70,,False,30,192,0.7875,0.3375,0.062,0.763,0.175,0.6124,0.8604064
1517,4022,4022,loccitane_jp,1289119258346020864,2020-07-31 08:42:36, summer special care skin exposed to ultraviolet rays eyes that tend to dry out in air conditioning recommended for such troubles are delicious fruity cheering mask juicy with a freshly picked fruit face mask ,91,,False,34,209,0.6342857142857142,0.3180952380952381,0.096,0.578,0.327,0.886,0.9030949
1518,4023,4023,loccitane_jp,1289032098565611520,2020-07-31 02:56:16, remote work and smartphone tired people mustsee l eye care update to the eyes with refreshing firmness ,0,,False,17,104,0.6333333333333333,0.0,0.144,0.697,0.159,0.0772,0.89491713
1519,4024,4024,loccitane_jp,1288441220948037634,2020-07-29 11:48:19,verbena game i tried already puzzle game that wins the items of verbena series hapikoi street presents a perfect happiness in summer please play from here ,94,,False,26,155,0.44,0.24,0.0,0.548,0.452,0.9403,0.88781524
1520,4025,4025,loccitane_jp,1288398527618363392,2020-07-29 08:58:40,there are many posts to remember roxytans instagram we plan to develop new projects such as instagram live one after another please look forward to it ,77,,False,26,151,0.4886363636363636,0.1931818181818181,0.0,0.916,0.084,0.3182,0.88741136
1521,4026,4026,loccitane_jp,1288292020222484481,2020-07-29 01:55:27, lxiacitan greenti a lot of citrus rides this year on top of the green tiness of lxiasitan greenity with jasmine and mate feeling will stand up sharply after passing the fresh citrus top,0,,False,33,186,0.51,0.195,0.0,0.791,0.209,0.6597,0.9436343
1522,4027,4027,loccitane_jp,1288035258823147521,2020-07-28 08:55:10, roxitans ninfa has already made a reservation for a mist hand cream kit and mist stock ,0,,False,16,88,0.0,0.0,0.0,0.802,0.198,0.4939,0.9307171
1523,4028,4028,loccitane_jp,1287941184229269505,2020-07-28 02:41:21, i bought a leg mousse of roxytan and foam face wash foam i was looking for oil or cream for leg massage and none of it came well but this is the best foam face wash is surprisingly mokoko ,0,,False,39,189,0.4,0.85,0.0,0.765,0.235,0.8793,0.9229436
1524,4029,4029,loccitane_jp,1287665642653376513,2020-07-27 08:26:27,which scent is perfect for your current mood verbena fresh and cool verbena is a citrus verbena when you want to relax and the citrus verbena juicy and bouncy scent is when you want to work hard ,224,,False,37,195,0.6183333333333333,0.2716666666666666,0.032,0.656,0.312,0.886,0.8730209
1525,4030,4030,loccitane_jp,1286955784018857984,2020-07-25 09:25:44, there are many cute and practical roxyn novelties that i just buy ,0,,False,12,67,0.75,0.5,0.0,0.769,0.231,0.4588,0.8963387
1526,4031,4031,loccitane_jp,1286822919432097793,2020-07-25 00:37:46, i bought a mary melon lip scrub of roxytan i love melons and it is fun to use it with a really sweet good scent that i am happy after i am worried about lip scrub i am looking forward to using scalp cleansing ,0,,False,44,210,0.6100000000000001,0.53,0.043,0.609,0.347,0.9475,0.899318
1527,4032,4032,loccitane_jp,1286574785921605637,2020-07-24 08:11:47, enjoy uv fresh body lotion icy leg mousse granite body gel cool cool and comfortable get a smooth body for more information ,110,,False,22,125,0.525,0.3249999999999999,0.0,0.544,0.456,0.9081,0.8243519
1528,4033,4033,loccitane_jp,1286260769982619648,2020-07-23 11:23:59,popularity ranking now hot update the latest popularity ranking of the official online shop verbena body hand verbena complete aqua leotier refreshing eye gel chess items you care about ,79,,False,29,186,0.7875,0.3375,0.0,0.665,0.335,0.9118,0.8631649
1529,4034,4034,loccitane_jp,1286231748288720897,2020-07-23 09:28:40, i almost used up my handheld roxytan verbena eau de toiree which is no longer indispensable to life but i went out with this with an elegant fragrance that i do not get tired of and before taking a bath while sleeping at work,0,,False,44,226,0.8666666666666666,0.1666666666666666,0.035,0.807,0.158,0.769,0.90209615
1530,4035,4035,loccitane_jp,1286089617767161856,2020-07-23 00:03:53, during the spa campaign with relaxing essential oil foot care aromacology foot relief is off please take this opportunity to experience the best relaxation time ,71,,False,25,162,0.3,0.5,0.0,0.448,0.552,0.969,0.87633896
1531,4036,4036,loccitane_jp,1285873624176459776,2020-07-22 09:45:37, lavender flower soap soap with highquality lavender oil and flowers tightly confined the fragrance that calms the mind clear old keratin enjoy luxurious bath time ,109,,False,25,164,0.3422619047619047,0.1053571428571428,0.0,0.731,0.269,0.7964,0.8973076
1532,4037,4037,loccitane_jp,1285751839506305024,2020-07-22 01:41:41, i had made a reservation for roxytan but i got a notice that i had reserved an ordinifer while i thought that it was an absolute good scent but it was a good scent ,0,,False,34,165,0.7000000000000001,0.5333333333333333,0.0,0.765,0.235,0.8271,0.84250104
1533,4038,4038,loccitane_jp,1285498680070422529,2020-07-21 08:55:43, eau doninfa fragrance that brings happiness is the longawaited limited reprint lineup eau de towale hair mist shower gel hand cream soft body cream ,167,,False,24,149,0.2309523809523809,0.2428571428571428,0.064,0.707,0.229,0.7096,0.8973739
1534,4039,4039,loccitane_jp,1285380363301187584,2020-07-21 01:05:34, i bought a roxytan eye serum that kuma had been worried about for a long time because of his eternal troubles and my eyes were getting dark the next morning i have no choice but to recommend ,0,,False,37,192,0.2666666666666666,-0.0666666666666666,0.139,0.774,0.087,0.0129,0.9040477
1535,4040,4040,loccitane_jp,1285146729814212608,2020-07-20 09:37:11, new release popular no verbena new granité body gel icy leg mousse icy shower gel get exhilarating body ,128,,False,18,105,0.4848484848484848,0.2287878787878787,0.097,0.661,0.242,0.5106,0.8571454
1536,4041,4041,loccitane_jp,1285022064298962945,2020-07-20 01:21:49, i bought a head scrub that i bought because it was very pleasant to try it a little by the clerk at roxytan who stopped by on the way back i bought it from now on i can take care of my scalp and im looking forward to using it ,0,,False,50,227,0.5,0.2552777777777777,0.038,0.825,0.137,0.7089,0.89961624
1537,4042,4042,loccitane_jp,1284702720625000448,2020-07-19 04:12:51, i was able to meet a good lotion after a long time when i think that it became difficult to feel brighter and brighter skin it will be thick and moisturizing mochimochi lxiamen reine blanc healed every day by the scent of flowers like tin run,0,,False,46,243,0.62,0.0699999999999999,0.05,0.739,0.212,0.7964,0.87776506
1538,4043,4043,loccitane_jp,1284430854396108800,2020-07-18 10:12:33, i bought the cream of the sunscreen of roxytans verbena that i was not good at the sewing feeling of sunscreen for a long time i was very refreshed because i was close to the age and had almost no chance to talk with people because i was close to the age and talked with people ,0,,False,56,279,0.4333333333333333,-0.0666666666666666,0.081,0.859,0.06,-0.2712,0.9156352
1539,4044,4044,loccitane_jp,1284103308320243713,2020-07-17 12:31:00,popularity ranking now hot update the latest popularity ranking of the official online shop verbena body hand verbena complete aqua leotier refreshing eye gel chess items you care about ,79,,False,29,186,0.7875,0.3375,0.0,0.665,0.335,0.9118,0.8631647
1540,4045,4045,loccitane_jp,1284062408860811267,2020-07-17 09:48:29, in suppresses the spread of swell hair even in hot and humid environments protect hair from the heat and sunlight of the dryer smooth and fingerlike smooth glossy finish morning styling and de ,44,loccitane_jp,False,33,194,0.6166666666666667,0.35,0.0,0.925,0.075,0.3818,0.90011823
1541,4046,4046,loccitane_jp,1284062406902026240,2020-07-17 09:48:29, repair hair milk serum from the five herbs repair series that won numerous bescos hair milk serum is newly released while protecting it from damage caused by heat and sunlight ,87,,False,30,177,0.4772727272727273,0.0681818181818181,0.092,0.802,0.106,0.128,0.9364462
1542,4047,4047,loccitane_jp,1283960112588025856,2020-07-17 03:02:00,get verbena items fun puzzle game with the verbena citrus verbena motif hapikoi street is here present the perfect product for summer please play here,75,,False,25,150,0.4,0.2249999999999999,0.0,0.642,0.358,0.8934,0.8639214
1543,4048,4048,loccitane_jp,1283940767564623873,2020-07-17 01:45:08, perfume coloring the scent of roxitans peony is a sweet scent but i do not get tired at all rollon so i like this that it is easy to carry ,0,,False,30,140,0.7277777777777779,0.1277777777777777,0.0,0.633,0.367,0.9235,0.89154714
1544,4049,4049,loccitane_jp,1283683132512722947,2020-07-16 08:41:23,how to use place in a clean container with a sparkling cleanser mix until mousse spread on skin and rinse ,42,loccitane_jp,False,20,106,0.7000000000000001,0.3666666666666667,0.0,0.766,0.234,0.5994,0.9023914
1545,4050,4050,loccitane_jp,1283683130826584064,2020-07-16 08:41:22, enzyme pack new release sense recipe sparkling cleanser deep face wash to the depths of pores with the power of enzyme clear old keratin and pore dirt to skin that is moisturized by moisturizing skin with a peeling effect ,82,,False,39,223,0.3594696969696969,0.0840909090909091,0.057,0.829,0.114,0.34,0.91903365
1546,4051,4051,loccitane_jp,1283582871467261952,2020-07-16 02:02:59, roxytans cherry blossom body cream is really the best solid and smooth smooth and above all exquisite moisturizing power my body itches if i moisturize too much but this does not become so and moisturizes as much as necessary,0,,False,39,226,0.4333333333333333,0.3555555555555555,0.0,0.896,0.104,0.489,0.9335995
1547,4052,4052,loccitane_jp,1283315271290109952,2020-07-15 08:19:38,the present is a present of the limited new product set massager icy leg mousse body gel of verbena which surely survives a hot summer in exhilaration ,37,loccitane_jp,False,27,151,0.3480416408987837,0.1021335807050092,0.068,0.827,0.104,0.25,0.8864195
1548,4053,4053,loccitane_jp,1283314980423491584,2020-07-15 08:18:28,photocon we will hold a photo contest where new products of fragrance verbena that call the new release encounter today please post a scene that you wish to have such an encounter this summer with your favorite photos for more information please click on instagram,93,,False,45,264,0.5818181818181818,0.2545454545454545,0.0,0.791,0.209,0.8519,0.9115942
1549,4054,4054,loccitane_jp,1283228326706864128,2020-07-15 02:34:08, it is always a verbena series because it is a woman who usually loves roxytan but this green tea is roxytan green tea ,0,,False,23,119,0.2833333333333334,-0.2166666666666666,0.0,0.895,0.105,0.3291,0.8471346
1550,4055,4055,loccitane_jp,1282952405642960898,2020-07-14 08:17:44,new color appearance juicy ever summer lip new color appears from the allpurpose lip of keeping color and moisturizing for a long time being paowaful confident adult red lip bare pomegranate feminine blue pink this summer is different from usual color ,124,,False,41,252,0.3447658402203857,0.0475206611570247,0.0,0.924,0.076,0.4939,0.89197946
1551,4056,4056,loccitane_jp,1282950873287520261,2020-07-14 08:11:38,from the viewpoint of preventing the spread of covid we are currently suspending the collection of vacant containers at stores for the time being which is part of the roxytan green program for details please check this link ,62,,False,38,224,0.35,-0.1,0.028,0.914,0.058,0.296,0.88022935
1552,4057,4057,loccitane_jp,1282844403833290752,2020-07-14 01:08:34, i went because i was planning to take a picture of materials of shibuya or omotesando that i finally got the package drawn by mr harumushi of the staff ,0,,False,29,153,1.0,0.0,0.0,1.0,0.0,0.0,0.90941125
1553,4058,4058,loccitane_jp,1282591213887971328,2020-07-13 08:22:29, refresh your sticky body quickly aqualeotier hydration mist pure freshness shining vinegar verbena isita orets compact cool ,104,,False,17,125,0.5499999999999999,0.2992063492063492,0.0,0.874,0.126,0.3182,0.88580555
1554,4059,4059,loccitane_jp,1282500175362056192,2020-07-13 02:20:44, this seems to have the effect of brightening the skin if the fragrance of the flower full of the happiness sense full of the sense of quality of every day is irresistible to wrap the face with a soft dense bubble that the face wash of the push is not tired at all of lxitanes illuminating cleansing foam so that i really want to lipi as many as many,0,,False,69,350,0.44375,0.3625,0.0,0.818,0.182,0.9146,0.85718
1555,4060,4060,loccitane_jp,1282137747163983872,2020-07-12 02:20:34, roxitan true story essential items for summer provence herbal vinegar effective for the care of damaged hair and essential item in summer refreshing summer hair care with pure freshness incorporating the wisdom of herbal vinegar,0,,False,35,229,0.5916666666666667,0.2773809523809523,0.061,0.609,0.33,0.9153,0.8904109
1556,4061,4061,loccitane_jp,1281884734012833793,2020-07-11 09:35:11, get smooth hair with hair care items made with roxytan herbs ,0,,False,11,62,0.5,0.4,0.0,0.758,0.242,0.4939,0.871433
1557,4062,4062,loccitane_jp,1281505805011832837,2020-07-10 08:29:27,the summer preparation is well equipped shear rich body scrub with the scrub of the cream removes roughness to moist skin repair hair mask to repair damage to the inside of hair intensive care mask ,79,,False,35,198,0.75,0.375,0.074,0.719,0.206,0.6908,0.8888818
1558,4063,4063,loccitane_jp,1281398175459205120,2020-07-10 01:21:46, the sweet change from the refreshing grassy feeling of the lquincitan el babere top that i bought after all is soft and it feels very good at this time of year ,0,,False,31,161,0.656,0.4720000000000001,0.0,0.733,0.267,0.8173,0.8976165
1559,4064,4064,loccitane_jp,1281211225615949824,2020-07-09 12:58:54,popularity ranking now hot online shop popularity ranking update five herbs pure freshness complete five herbs pure freshness deep cleansing care citrus verbena ,71,,False,23,161,0.53,0.1557142857142857,0.0,0.68,0.32,0.8555,0.8967405
1560,4065,4065,loccitane_jp,1281039130512650240,2020-07-09 01:35:03, the immortelle divine series of roxytan arrives with a spicy bouquet this time a new ingredient that supports the skin structure is added to the oil serum cream and the renewal lotion is a talented series that you can feel the firm elasticity in a new package ,0,,False,47,261,0.5522727272727272,0.1931818181818181,0.0,0.81,0.19,0.8555,0.9047384
1561,4066,4066,loccitane_jp,1280800757990567936,2020-07-08 09:47:51,roxytans true story an essential item for summer provence herbal vinegar effective for the care of damaged hair and an indispensable item in summer with pure freshness incorporating the wisdom of herbal vinegar summer hair ke ,141,,False,36,226,0.63,0.3128571428571428,0.062,0.668,0.269,0.8625,0.86621773
